{
  "$schema": "https://json-schema.org/draft/2020-12/schema",
  "$id": "https://cloudhal.dev/schemas/v1/automation.schema.json",
  "title": "Automation",
  "description": "A recurring job on a site (RFC-0008), created by a person in Studio: either a built-in deterministic job that Cloudhal runs itself (reports, findings and notifications; it never publishes), or a scheduled agent task that an external agent picks up over MCP with the automation's own key, inside a run window, under a mode cap and budgets. No language model runs inside Cloudhal. Scheduling never grants rights: every call of a task runs with the key's scopes narrowed to its owner's current role. Automations live in D1 next to the graph; they are not graph nodes and are not part of site bundles.",
  "type": "object",
  "additionalProperties": false,
  "required": [
    "schemaVersion",
    "id",
    "siteId",
    "name",
    "job",
    "recurrence",
    "state",
    "consecutiveFailures",
    "owner",
    "createdAt",
    "updatedAt",
    "rev"
  ],
  "properties": {
    "schemaVersion": { "$ref": "common.schema.json#/$defs/SchemaVersion" },
    "id": { "$ref": "#/$defs/AutomationId" },
    "siteId": { "$ref": "common.schema.json#/$defs/Id" },
    "name": {
      "type": "string",
      "minLength": 1,
      "maxLength": 120,
      "pattern": "^[^\\x00-\\x1F\\x7F\\u202A-\\u202E\\u2066-\\u2069]+$"
    },
    "job": { "$ref": "#/$defs/AutomationJob" },
    "recurrence": { "$ref": "#/$defs/AutomationRecurrence" },
    "state": { "$ref": "#/$defs/AutomationState" },
    "pausedReason": {
      "type": "string",
      "description": "Why the automation is not `active`: a person paused it; its agent paused it; three consecutive failures; a run exceeded its budget; the site's kill switch; its key was revoked; its owner left or no longer holds the scopes it needs.",
      "enum": [
        "person",
        "agent",
        "failures",
        "budget",
        "kill-switch",
        "key-revoked",
        "owner-removed",
        "role-changed"
      ]
    },
    "consecutiveFailures": { "type": "integer", "minimum": 0 },
    "owner": { "$ref": "#/$defs/AutomationOwner" },
    "nextRunAt": { "$ref": "common.schema.json#/$defs/Timestamp" },
    "createdAt": { "$ref": "common.schema.json#/$defs/Timestamp" },
    "updatedAt": { "$ref": "common.schema.json#/$defs/Timestamp" },
    "rev": { "$ref": "common.schema.json#/$defs/Revision" },
    "metadata": { "$ref": "common.schema.json#/$defs/Metadata" }
  },
  "$defs": {
    "AutomationId": {
      "type": "string",
      "description": "An automation id: `aut_` and 6 to 32 letters or digits.",
      "pattern": "^aut_[A-Za-z0-9]{6,32}$"
    },
    "AutomationState": {
      "type": "string",
      "description": "`active` runs on its recurrence; `paused` and `auto-paused` (by failures or a budget) wait for a person to resume; `broken` needs a person to repair it (key revoked, owner gone); `ended` reached its COUNT or UNTIL.",
      "enum": ["active", "paused", "auto-paused", "broken", "ended"]
    },
    "AutomationOwner": {
      "type": "object",
      "description": "The person who created the automation and owns its key (`user_…`). Agents never own automations.",
      "additionalProperties": false,
      "required": ["id"],
      "properties": {
        "id": {
          "type": "string",
          "pattern": "^user_[A-Za-z0-9]{6,32}$"
        },
        "name": { "type": "string", "maxLength": 200 }
      }
    },
    "AutomationRule": {
      "type": "string",
      "description": "The recurrence as an RFC 5545 RRULE value in Cloudhal's subset, without the `RRULE:` prefix: FREQ DAILY, WEEKLY or MONTHLY; INTERVAL; BYDAY (ordinals such as 2TU or -1FR only with MONTHLY); BYMONTHDAY (1–31 or -1); BYHOUR; BYMINUTE; COUNT or UNTIL. The pattern bounds the vocabulary; the parser refuses repeated parts, COUNT with UNTIL, ordinals outside MONTHLY and runs closer than the job's minimum interval.",
      "maxLength": 300,
      "pattern": "^FREQ=(?:DAILY|WEEKLY|MONTHLY)(?:;(?:INTERVAL=[1-9][0-9]{0,2}|BYDAY=(?:[+-]?[1-5])?(?:MO|TU|WE|TH|FR|SA|SU)(?:,(?:[+-]?[1-5])?(?:MO|TU|WE|TH|FR|SA|SU)){0,6}|BYMONTHDAY=(?:-1|[1-9]|[12][0-9]|3[01])(?:,(?:-1|[1-9]|[12][0-9]|3[01])){0,30}|BYHOUR=(?:[01]?[0-9]|2[0-3])(?:,(?:[01]?[0-9]|2[0-3])){0,23}|BYMINUTE=[0-5]?[0-9](?:,[0-5]?[0-9]){0,3}|COUNT=[1-9][0-9]{0,3}|UNTIL=[0-9]{8}T[0-9]{6}Z))*$"
    },
    "AutomationRecurrence": {
      "type": "object",
      "description": "When the automation runs: the first occurrence as a wall-clock time in `timeZone`, repeated by `rule` (absent: once). Occurrences are computed in the zone, so \"Mondays 09:07\" stays 09:07 across daylight-saving changes; a time that does not exist on a given day (a spring-forward gap) runs at the next valid minute, and a time that occurs twice runs once, at the first (a documented deviation from RFC 5545 §3.3.10, which drops such occurrences). `preset` records which Studio choice produced the rule.",
      "additionalProperties": false,
      "required": ["start", "timeZone", "preset"],
      "properties": {
        "start": { "$ref": "common.schema.json#/$defs/LocalDateTime" },
        "timeZone": { "$ref": "common.schema.json#/$defs/TimeZone" },
        "rule": { "$ref": "#/$defs/AutomationRule" },
        "preset": {
          "type": "string",
          "enum": ["once", "hourly", "daily", "weekdays", "weekly", "monthly", "custom"]
        }
      }
    },
    "AutomationBudget": {
      "type": "object",
      "description": "Per-run limits Cloudhal counts and enforces for an agent task: tool calls, mutations, approval requests filed and minutes since the run began. Exceeding one ends the run (`budget-exceeded`) and pauses the automation.",
      "additionalProperties": false,
      "required": ["maxToolCalls", "maxWrites", "maxApprovalRequests", "maxMinutes"],
      "properties": {
        "maxToolCalls": { "type": "integer", "minimum": 1, "maximum": 500 },
        "maxWrites": { "type": "integer", "minimum": 0, "maximum": 200 },
        "maxApprovalRequests": { "type": "integer", "minimum": 0, "maximum": 20 },
        "maxMinutes": { "type": "integer", "minimum": 1, "maximum": 240 }
      }
    },
    "AutomationJob": {
      "description": "What runs, discriminated by `kind`.",
      "oneOf": [
        {
          "type": "object",
          "title": "BuiltinAutomationJob",
          "description": "A deterministic job Cloudhal runs itself, in bounded steps. Its outputs are findings, reports and Studio notifications; it never changes or publishes content.",
          "additionalProperties": false,
          "required": ["kind", "builtin"],
          "properties": {
            "kind": { "type": "string", "enum": ["builtin"] },
            "builtin": {
              "type": "string",
              "enum": ["broken-links", "stale-content", "feed-check", "weekly-digest", "cleanup"]
            },
            "staleAfterDays": {
              "type": "integer",
              "description": "`stale-content` only: entries not updated for this many days are listed for review.",
              "minimum": 30,
              "maximum": 1095
            }
          }
        },
        {
          "type": "object",
          "title": "AgentTaskAutomationJob",
          "description": "A task an external agent performs over MCP. At each occurrence a run window opens for `windowMinutes`; the automation's key (`keyId`, owned by the automation's owner) is valid only inside an open run, which the agent starts with `begin_run` and ends with `end_run`. The run's mode is the key's effective mode capped by `modeCap`; it never waits for a person: calls that need one leave an approval request and the run ends. `readsUntrustedText` declares that the task reads visitor-supplied text (comments, 404 paths, fetched pages); such an automation's key cannot hold write scopes, and any run that reads such text is limited to reading, labelling and hiding from then on.",
          "additionalProperties": false,
          "required": [
            "kind",
            "keyId",
            "instructions",
            "modeCap",
            "readsUntrustedText",
            "windowMinutes",
            "budget"
          ],
          "properties": {
            "kind": { "type": "string", "enum": ["agent-task"] },
            "keyId": {
              "type": "string",
              "pattern": "^[A-Za-z0-9_-]{6,64}$"
            },
            "instructions": {
              "type": "string",
              "description": "What the owner asks the agent to do, shown to the agent by `begin_run`. Plain text.",
              "minLength": 1,
              "maxLength": 2000,
              "pattern": "^[^\\x00-\\x08\\x0B-\\x1F\\x7F\\u202A-\\u202E\\u2066-\\u2069]+$"
            },
            "skill": {
              "type": "string",
              "description": "A skill the run declares (its scopes and approval list narrow the run further).",
              "pattern": "^[a-z0-9]+(?:-[a-z0-9]+)*$",
              "maxLength": 64
            },
            "modeCap": {
              "type": "string",
              "description": "The most autonomous mode a run may use; never `bypass`.",
              "enum": ["plan", "manual", "edits", "auto"]
            },
            "readsUntrustedText": { "type": "boolean" },
            "windowMinutes": { "type": "integer", "minimum": 5, "maximum": 240 },
            "budget": { "$ref": "#/$defs/AutomationBudget" }
          }
        }
      ]
    }
  }
}
