{
  "schemaVersion": 1,
  "id": "aut_01HZXD4F6H8M",
  "siteId": "site_01HZX8K3Q9EF",
  "name": "Monthly analytics digest",
  "job": {
    "kind": "builtin",
    "builtin": "weekly-digest"
  },
  "recurrence": {
    "start": "2026-11-02T09:07",
    "timeZone": "Europe/Berlin",
    "rule": "FREQ=MONTHLY;BYDAY=1MO;BYHOUR=9;BYMINUTE=7;COUNT=12",
    "preset": "custom"
  },
  "state": "active",
  "consecutiveFailures": 0,
  "owner": {
    "id": "user_01HZX8K3Q9AY",
    "name": "Ayşe Demir"
  },
  "nextRunAt": "2026-10-19T06:07:00Z",
  "createdAt": "2026-10-12T10:00:00Z",
  "updatedAt": "2026-10-12T10:00:00Z",
  "rev": 0
}
